{
  "$schema": "https://adjective.us/prelude/schemas/v1/architecture.schema.json",
  "version": "1.0.0",
  "directories": [
    {
      "path": "bench",
      "fileCount": 1
    },
    {
      "path": "bin",
      "fileCount": 1,
      "purpose": "Executable entry points"
    },
    {
      "path": "schemas",
      "fileCount": 10,
      "purpose": "Data schemas"
    },
    {
      "path": "src",
      "fileCount": 7
    },
    {
      "path": "src/commands",
      "fileCount": 17,
      "purpose": "Command handlers"
    },
    {
      "path": "src/core",
      "fileCount": 20,
      "purpose": "Core business logic"
    },
    {
      "path": "src/mcp",
      "fileCount": 3,
      "purpose": "MCP server"
    },
    {
      "path": "src/runtime",
      "fileCount": 2,
      "purpose": "Runtime environment helpers"
    },
    {
      "path": "src/schema",
      "fileCount": 10,
      "purpose": "Data schemas"
    },
    {
      "path": "src/utils",
      "fileCount": 6,
      "purpose": "Utility functions"
    },
    {
      "path": "tests",
      "fileCount": 22,
      "purpose": "Tests"
    }
  ],
  "entryPoints": [
    {
      "file": "bin/prelude.ts",
      "purpose": "CLI entry point"
    }
  ],
  "type": "cli",
  "patterns": [
    "Utility modules"
  ],
  "conventions": [
    "ESLint code linting",
    "TypeScript strict mode"
  ],
  "importPatterns": {
    "heavyImporters": [
      "bin/prelude.ts",
      "src/commands/init.ts",
      "src/commands/update.ts",
      "src/core/updater.ts",
      "src/mcp/server.ts"
    ]
  }
}